Domain Name,Domain Type,Agency,Organization Name,City,State,Security Contact Email,modification,commit_datetime,commit_date
ich.gov,Federal - Executive,United States Interagency Council on Homelessness,United States Interagency Council on Homelessness,Washington,DC,(blank),changed_old,2024-09-14 06:08:51+00:00,1726294131
ich.gov,Federal - Executive,U.S. Interagency Council on Homelessness,United States Interagency Council on Homelessness,Washington,DC,(blank),changed_new,2024-09-14 06:08:51+00:00,1726294131
usich.gov,Federal - Executive,United States Interagency Council on Homelessness,United States Interagency Council on Homelessness,Washington,DC,(blank),changed_old,2024-09-14 06:08:51+00:00,1726294131
usich.gov,Federal - Executive,U.S. Interagency Council on Homelessness,United States Interagency Council on Homelessness,Washington,DC,(blank),changed_new,2024-09-14 06:08:51+00:00,1726294131
ustda.gov,Federal - Executive,United States Trade and Development Agency,US Trade and Development Agency,Arlington,VA,avicchiollo@ustda.gov,changed_old,2024-09-14 06:08:51+00:00,1726294131
ustda.gov,Federal - Executive,U.S. Trade and Development Agency,US Trade and Development Agency,Arlington,VA,avicchiollo@ustda.gov,changed_new,2024-09-14 06:08:51+00:00,1726294131
