Domain Name,Domain Type,Agency,Organization Name,City,State,Security Contact Email,modification,commit_datetime,commit_date
crimevictims.gov,Federal - Executive,Department of Justice,Office of Justice Programs,Washington,DC,Responsible_Disclosure@usdoj.gov,deleted,2025-10-01 06:12:03+00:00,1759299123
juvenilecouncil.gov,Federal - Executive,Department of Justice,Office of Justice Programs,Washington,DC,Responsible_Disclosure@usdoj.gov,deleted,2025-10-01 06:12:03+00:00,1759299123
mymedicare.gov,Federal - Executive,Department of Health and Human Services,Centers for Medicare and Medicaid Services,Baltimore,MD,WETG_Security@cms.hhs.gov,deleted,2025-10-01 06:12:03+00:00,1759299123
quantum.gov,Federal - Executive,Executive Office of the President,National Quantum Coordination Office (NQCO),Washington,DC,ramia@nitrd.gov,changed_old,2025-10-01 06:12:03+00:00,1759299123
quantum.gov,Federal - Executive,Executive Office of the President,National Quantum Coordination Office (NQCO),Washington,DC,baranyuk@nitrd.gov,changed_new,2025-10-01 06:12:03+00:00,1759299123
